"AT4G00100","uS15y","Ribosomal Protein uS15y","Encodes a cytoplasmic ribosomal protein S13 homologue involved in early leaf development The mRNA is cell-to-cell mobile.; RIBOSOMAL PROTEIN S13A (RPS13A); RIBOSOMAL PROTEIN S13A (ATRPS13A);RIBOSOMAL PROTEIN S13A (RPS13A);POINTED FIRST LEAF 2 (PFL2); (RPS13); RPS13A","uS15B","AT4G00100.1"
"AT4G00810","P1z","Ribosomal Protein P1z","Co-orthologous gene of large ribosomal subunit protein RPP1.; 60S ACIDIC RIBOSOMAL PROTEIN P1-2 (RPP1B); RPP1 CO-ORTHOLOGOUS GENE 2 (RPP1.2);60S ACIDIC RIBOSOMAL PROTEIN P1-2 (RPP1B); RPP1B","P1B","AT4G00810.1"
"AT4G02230","eL19y","Ribosomal Protein eL19y","Ribosomal protein L19e family protein ; ","eL19C","AT4G02230.1"
"AT4G09800","uS13x","Ribosomal Protein uS13x","encodes a ribosomal protein S18C, a constituent of the small subunit of the ribosomal complex; S18 RIBOSOMAL PROTEIN (RPS18C); S18 RIBOSOMAL PROTEIN (RPS18C); RPS18C","uS13C","AT4G09800.1"
"AT4G10450","uL6x","Ribosomal Protein uL6x","Ribosomal protein L6 family ; ","uL6D","AT4G10450.1"
"AT4G13170","uL13x","Ribosomal Protein uL13x","Ribosomal protein L13 family protein ; ","uL13C","AT4G13170.1"
"AT4G14320","eL42y","Ribosomal Protein eL42y","Zinc-binding ribosomal protein family protein; RPL36A B (RPL36AB); RPL36A B (RPL36AB);APICULATA 2 (API2); RPL36AB","eL42B","AT4G14320.2"
"AT4G15000","eL27x","Ribosomal Protein eL27x","Ribosomal L27e protein family ; ","eL27C","AT4G15000.1"
"AT4G16720","eL15z","Ribosomal Protein eL15z","Ribosomal protein L23/L15e family protein ; ","eL15A","AT4G16720.1"
"AT4G17390","eL15y","Ribosomal Protein eL15y","Ribosomal protein L23/L15e family protein ; ","eL15B","AT4G17390.1"
"AT4G18100","eL32z","Ribosomal Protein eL32z","Ribosomal protein L32e ; ","eL32A","AT4G18100.1"
"AT4G18730","uL5x","Ribosomal Protein uL5x","encodes a cytosolic ribosomal protein L16, which is a constituent of 60S large ribosomal complex. Gene is expressed in root and shoot apical meristems and in lateral root primordia. Expression in lateral root primordia is induced by auxin.; RIBOSOMAL PROTEIN L16B (RPL16B); RIBOSOMAL PROTEIN L16B (RPL16B); RPL16B","uL5C","AT4G18730.1"
"AT4G25740","eS10z","Ribosomal Protein eS10z","RNA binding Plectin/S10 domain-containing protein ; ","eS10A","AT4G25740.1"
"AT4G25890","P3z","Ribosomal Protein P3z","60S acidic ribosomal protein family ; ","P3A","AT4G25890.1"
"AT4G26230","eL31y","Ribosomal Protein eL31y","Ribosomal protein L31e family protein ; ","eL31B","AT4G26230.1"
"AT4G27090","eL14y","Ribosomal Protein eL14y","Ribosomal protein L14 ; ","eL14B","AT4G27090.1"
"AT4G29390","eS30y","Ribosomal Protein eS30y","Ribosomal protein S30 family protein ; ","eS30B","AT4G29390.1"
"AT4G29410","eL28y","Ribosomal Protein eL28y","Ribosomal L28e protein family ; ","eL28C","AT4G29410.1"
"AT4G30800","uS17y","Ribosomal Protein uS17y","Nucleic acid-binding, OB-fold-like protein ; ","uS17B","AT4G30800.1"
"AT4G31700","eS6z","Ribosomal Protein eS6z","Encodes a putative ribosomal protein S6 (rps6a). RPS6A and RPS6B are fully redundant and essential during gametogenesis.; RIBOSOMAL PROTEIN S6 (RPS6); RIBOSOMAL PROTEIN S6 (RPS6); (ATRPS6); (RPS6A); RPS6","eS6A","AT4G31700.1"
"AT4G31985","eL39x","Ribosomal Protein eL39x","Ribosomal protein L39 family protein ; ","eL39C","AT4G31985.1"
"AT4G33865","uS14x","Ribosomal Protein uS14x","Ribosomal protein S14p/S29e family protein ; ","uS14C","AT4G33865.1"
"AT4G34555","eS25x","Ribosomal Protein eS25x","Ribosomal protein S25 family protein ; ","eS25D","AT4G34555.1"
"AT4G34670","eS1y","Ribosomal Protein eS1y","Ribosomal protein S3Ae ; ","eS1B","AT4G34670.1"
"AT4G36130","uL2x","Ribosomal Protein uL2x","Ribosomal protein L2 family ; ","uL2C","AT4G36130.1"
"AT4G39200","eS25w","Ribosomal Protein eS25w","Ribosomal protein S25 family protein ; ","eS25E","AT4G39200.1"
"AT5G02450","eL36x","Ribosomal Protein eL36x","Ribosomal protein L36e family protein ; ","eL36C","AT5G02450.1"
"AT5G02610","uL29w","Ribosomal Protein uL29w","Ribosomal L29 family protein ; ","uL29D","AT5G02610.2"
"AT5G02870","uL4y","Ribosomal Protein uL4y","Ribosomal protein L4/L1 family; RIBOSOMAL LARGE SUBUNIT 4 (RPL4); RIBOSOMAL LARGE SUBUNIT 4 (RPL4); RPL4","uL4D","AT5G02870.1"
"AT5G02960","uS12y","Ribosomal Protein uS12y","Ribosomal protein S12/S23 family protein ; ","uS12B","AT5G02960.1"
"AT5G03850","eS28y","Ribosomal Protein eS28y","Nucleic acid-binding, OB-fold-like protein ; ","eS28B","AT5G03850.1"
"AT5G04800","eS17w","Ribosomal Protein eS17w","Ribosomal S17 family protein ; ","eS17D","AT5G04800.2"
"AT5G07090","eS4y","Ribosomal Protein eS4y","Ribosomal protein S4 (RPS4A) family protein ; ","eS4B","AT5G07090.1"
"AT5G09490","uS19z","Ribosomal Protein uS19z","Ribosomal protein S19 family protein ; ","uS19B","AT5G09490.1"
"AT5G09500","uS19y","Ribosomal Protein uS19y","Ribosomal protein S19 family protein ; ","uS19C","AT5G09500.1"
"AT5G09510","uS19x","Ribosomal Protein uS19x","Ribosomal protein S19 family protein ; ","uS19D","AT5G09510.1"
"AT5G10360","eS6y","Ribosomal Protein eS6y","RPS6A and RPS6B are fully redundant and essential during gametogenesis.; EMBRYO DEFECTIVE 3010 (EMB3010); RIBOSOMAL PROTEIN SMALL SUBUNIT 6B (RPS6B);EMBRYO DEFECTIVE 3010 (EMB3010); EMB3010","eS6B","AT5G10360.1"
"AT5G15200","uS4z","Ribosomal Protein uS4z","Ribosomal protein S4 ; ","uS4B","AT5G15200.1"
"AT5G15520","eS19y","Ribosomal Protein eS19y","Ribosomal protein S19e family protein ; ","eS19B","AT5G15520.1"
"AT5G16130","eS7x","Ribosomal Protein eS7x","Ribosomal protein S7e family protein ; ","eS7C","AT5G16130.1"
"AT5G18380","uS9x","Ribosomal Protein uS9x","Ribosomal protein S5 domain 2-like superfamily protein ; ","uS9C","AT5G18380.1"
"AT5G20290","eS8z","Ribosomal Protein eS8z","Ribosomal protein S8e family protein ; ","eS8A","AT5G20290.1"
"AT5G22440","uL1x","Ribosomal Protein uL1x","Ribosomal protein L1p/L10e family ; ","uL1C","AT5G22440.1"
"AT5G23740","uS17x","Ribosomal Protein uS17x","Encodes a putative ribosomal protein S11 (RPS11-beta).; RIBOSOMAL PROTEIN S11-BETA (RPS11-BETA); RIBOSOMAL PROTEIN S11-BETA (RPS11-BETA); RPS11-BETA","uS17C","AT5G23740.1"
"AT5G23900","eL13x","Ribosomal Protein eL13x","Ribosomal protein L13e family protein ; ","eL13D","AT5G23900.1"
"AT5G24510","P1x","Ribosomal Protein P1x","60S acidic ribosomal protein family ; ","P1D","AT5G24510.1"
"AT5G27700","eS21y","Ribosomal Protein eS21y","Cytosolic ribosomal protein. Similar to EVR1 and redundant with EVR1. Also enhances VAR2 mutant varigation, but to a lesser extent than evr1.; EVERSHED1-LIKE 1 (EVR1L1); EVERSHED1-LIKE 1 (EVR1L1); (RPS21C); EVR1L1","eS21C","AT5G27700.1"
"AT5G27770","eL22y","Ribosomal Protein eL22y","Ribosomal L22e protein family ; ","eL22C","AT5G27770.1"
"AT5G27850","eL18x","Ribosomal Protein eL18x","Ribosomal protein L18e/L15 superfamily protein;  (RPL18C);  (RPL18C); RPL18C","eL18C","AT5G27850.1"
"AT5G28060","eS24y","Ribosomal Protein eS24y","Ribosomal protein S24e family protein;  (RPS24B);  (RPS24B); RPS24B","eS24B","AT5G28060.1"
"AT5G35530","uS3x","Ribosomal Protein uS3x","Ribosomal protein S3 family protein ; ","uS3C","AT5G35530.1"
"AT5G39740","uL18y","Ribosomal Protein uL18y","Encodes a ribosomal protein RPL5B that is involved in ribosome biogenesis and plays a role in organ size control by promoting cell proliferation and preventing compensation in normal leaf development.; RIBOSOMAL PROTEIN L5 B (RPL5B); RIBOSOMAL PROTEIN L5 B (RPL5B);OLIGOCELLULA 7 (OLI7); RPL5B","uL18B","AT5G39740.1"
"AT5G39850","uS4y","Ribosomal Protein uS4y","Ribosomal protein S4 ; ","uS4C","AT5G39850.1"
"AT5G40040","P2v","Ribosomal Protein P2v","60S acidic ribosomal protein family ; ","P2E","AT5G40040.1"
"AT5G41520","eS10y","Ribosomal Protein eS10y","The gene belongs  to  the  three-member  Arabidopsis  gene  family  encoding  the  eukaryote-specific protein S10e of the small cytoplasmic ribosomal subunit.; RIBOSOMAL PROTEIN S10E B (RPS10B); RIBOSOMAL PROTEIN S10E B (RPS10B); RPS10B","eS10B","AT5G41520.1"
"AT5G43640","uS19w","Ribosomal Protein uS19w","Ribosomal protein S19 family protein ; ","uS19E","AT5G43640.1"
"AT5G45775","uL5w","Ribosomal Protein uL5w","Ribosomal L5P family protein ; ","uL5D","AT5G45775.2"
"AT5G46430","eL32y","Ribosomal Protein eL32y","Ribosomal protein L32e ; ","eL32B","AT5G46430.1"
"AT5G47700","P1y","Ribosomal Protein P1y","Co-orthologous gene of large ribosomal subunit protein RPP1.; 60S ACIDIC RIBOSOMAL PROTEIN P1-3 (RPP1C); RPP1 CO-ORTHOLOGOUS GENE 3 (RPP1.3);60S ACIDIC RIBOSOMAL PROTEIN P1-3 (RPP1C); RPP1C","P1C","AT5G47700.1"
"AT5G47930","eS27w","Ribosomal Protein eS27w","Zinc-binding ribosomal protein family protein ; ","eS27D","AT5G47930.1"
"AT5G48760","uL13w","Ribosomal Protein uL13w","Ribosomal protein L13 family protein ; ","uL13D","AT5G48760.1"
"AT5G52650","eS10x","Ribosomal Protein eS10x","RNA binding Plectin/S10 domain-containing protein ; ","eS10C","AT5G52650.1"
"AT5G56670","eS30x","Ribosomal Protein eS30x","Ribosomal protein S30 family protein ; ","eS30C","AT5G56670.1"
"AT5G56710","eL31x","Ribosomal Protein eL31x","Ribosomal protein L31e family protein ; ","eL31C","AT5G56710.1"
"AT5G57290","P3y","Ribosomal Protein P3y","60S acidic ribosomal protein family; RIBOSOMAL P3 PROTEIN B (P3B);  (ATP3B);RIBOSOMAL P3 PROTEIN B (P3B); P3B","P3B","AT5G57290.1"
"AT5G58420","eS4x","Ribosomal Protein eS4x","Ribosomal protein S4 (RPS4A) family protein ; ","eS4D","AT5G58420.1"
"AT5G59240","eS8y","Ribosomal Protein eS8y","Ribosomal protein S8e family protein ; ","eS8B","AT5G59240.1"
"AT5G59850","uS8w","Ribosomal Protein uS8w","Ribosomal protein S8 family protein ; ","uS8F","AT5G59850.1"
"AT5G60670","uL11x","Ribosomal Protein uL11x","Ribosomal protein L11 family protein; RIBOSOMAL PROTEIN LIKE 12C (RPL12C); RIBOSOMAL PROTEIN LIKE 12C (RPL12C); RPL12C","uL11C","AT5G60670.1"
"AT5G61170","eS19x","Ribosomal Protein eS19x","Ribosomal protein S19e family protein ; ","eS19C","AT5G61170.1"
"AT5G62300","uS10x","Ribosomal Protein uS10x","Ribosomal protein S10p/S20e family protein ; ","uS10C","AT5G62300.1"
"AT5G63070","uS19v","Ribosomal Protein uS19v","Ribosomal protein S19 family protein ; ","uS19F","AT5G63070.1"
"AT5G64140","eS28x","Ribosomal Protein eS28x","Encodes a putative ribosomal protein S28.; RIBOSOMAL PROTEIN S28 (RPS28); RIBOSOMAL PROTEIN S28 (RPS28); RPS28","eS28C","AT5G64140.1"
"AT5G67510","uL24y","Ribosomal Protein uL24y","Translation protein SH3-like family protein ; ","uL24B","AT5G67510.1"
